,0,1
3898,"Hallucinated, would laugh hysterically for no reason for an hour, then would cry for an hour. This is only after taking one pill.",UNK
3899,It works wonders.,UNK
3900,"No trouble so far taking doxycycline after oral surgery, but tetracycline 250mg made me very, very dizzy.",UNK
3901,Not great med. Gained lots of weight. 15mg I was like a zombie. Tired alot and twitching.,UNK
3902,"simply wonderful for toothaches, muscle pain. no side effects.",UNK
3903,Works wonders with me. .,UNK
3904,Try it and see for yourself!!!,UNK
3905,Reduction in urination frequency has been a welcome effect however retrograde ejaculation and congestion have been unwelcome side effects.,UNK
3906,Allergic reaction,UNK
3907,"Lyrica seems to help with the pain, but it also has an effect of making my hands shake",UNK
3908,Seems to be working for me.,UNK
3909,"Good for my mood swings. Evens me out mentally. Anxiety decrease. 
Decrease of libido 90%",UNK
3910,Tried it for a month. For me it was ineffective.,UNK
3911,"It is good when it comes to controlling urges to use heroin. A very good medication, I have not yet gone through withdrawal symptoms.",UNK
3912,Don&#039;t use this if you have an addictive personality...almost killed me,UNK
3913,"so much acne! I have bad headaches, gained 10 pounds, and I am feelings super depressed and tired.",UNK
3914,"My period was late for 1 week, besides that it is working for me",UNK
3915,"This medicine is a life saver. As soon as I start taking the medicine, I seen an immediate response. I love it.",UNK
3916,Gained weight and joint pain,UNK
3917,On a minimum dose had significant memory problems and depression (lost 16 pounds).,UNK
3918,It doesn&#039;t work that great for pain but it does wonders for restless leg syndrome and stuff similar to that,UNK
3919,This product works well with my high cholesterol great medicine,UNK
3920,I&#039;ve used it for my son and it obviously works the way it should. ,UNK
3921,"My son timed it several times without me knowing and discovered in 10 mins I was doing so much better, in 20 I was completely back!",UNK
3922,It got me pretty sick. I threw up alot and had lost alot of fluids.,UNK
3923,"Bloating, stomach discomfort",UNK
3924,Very little effect on pain.,UNK
3925,Weight gain.,UNK
3926,This stuff is terrible. I switched to ndt and am doing way better. Please google stop the thyroid madness as synthoids popularity is madness.,UNK
3927,"Every drug I tried, allowed me to only achieve a sub-optimal response.  I have been in MMR for over a year.",UNK
3928,Kept me up all night. Was restless and nervous . Did not help my insomnia  at all.,UNK
3929,So far so good. I have been on Humira for over 2 years.,UNK
3930,"I used this twice a day in my nebulizer and it works great 
for my asthma although I use the strongest dosage 
because nothing else works.",UNK
3931,Neurontin has really helped my Restless leg syndrome.,UNK
3932,I have a 50% compression fracture of my L1 and Celebrex is the only thing that will alleviate the pain. Unfortunately it upsets my stomach.,UNK
3933,Great. Been taking it for years.,UNK
3934,Seemed to have no effect on my  URTI. No sickness from this antibiotic but I experience head pressure.,UNK
3935,This is a excellent medication I have lost 53lbs only on the injection alone know more hbp or know  more diabetes at all the is a wonder drug...,UNK
3936,This medicine caused me to gain almost 10 pounds even though I didn&#039;t change my eating habits and continued to exercise 5 times a week. ,UNK
3937,Given me a better quality of life,UNK
3938,"This medicine is the best - fast acting and relieves pain, spasms associated with urinary tract infections. Highly recommend it.",UNK
3939,It&#039;s very effective for bowel problems and reduced my pain to zero most of the time.,UNK
3940,It works!!!,UNK
3941,Its good.,UNK
3942,Seems to be the only antibiotic that will work for me.,UNK
3943,Very Effective With Few Side Effects.,UNK
3944,Takes away anxiety and panic attacks very well.,UNK
3945,"Great, I take it twice a day, it does the job. I feel really good.",UNK
3946,Controls my allergies better than anything I have taken.,UNK
3947,"This antibiotic keeps causing yeast infections, which do not seem worth the moderate benefit.",UNK
3948,I have had a good experience with this medication... Gain a little weight but nothing major.,UNK
3949,"Skin of my body and foot become yellow, vomiting sensation, headache.",UNK
3950,"Tried this product twice, every time I use it, in 3-4 days I get a sinus infection and sore throat.",UNK
3951,Works great and makes for an awesome sleep,UNK
3952,"It works great, especially for night pain.  Have it on the night stand, close and handy.",UNK
3953,Some of the stomach pain went away but this medicine gave me blurred vision.,UNK
3954,"The prep was for my wife who has chronic migraines.  A look at the ingredients reveals it contains Aspartame, which can trigger migraines.",UNK
3955,10 mg didn&#039;t work at all. Terrible side effects.,UNK
3956,"I am in the third month of my treatment.  It has helped with the oiliness of my skin, but I still have cysts that are being very stubborn.  ",UNK
3957,"Received 1st of three on 5/5/2014 no side effects, very little pain.",UNK
3958,Great medicine that will help me to live longer. My lipids have improved a lot since I started taking Vascepa 2g.,UNK
3959,"Very addictive neurotoxin. Stops working after a few months. Withdrawals include problems like psychosis, and dementia.",UNK
3960,Wow! worked great!  felt much better overnight.,UNK
3961,"I have been taking medicine for about a year. Really great but side effects dehaydrated,bladder never empty,heaviness in chest, stomach pain",UNK
3962,"I take Zoloft, Zyprexa and dothiepin. All very effective.",UNK
3963,Has eliminated daily sinus headaches and sore throats.,UNK
3964,I can certainly tell a difference when I don&#039;t take Naprosyn. I take 500 mg twice a day if needed.,UNK
3965,Do not take this! It caused my 8 yrs old grave mental issues!,UNK
3966,Pudendal neuralgia caused by (Transurethral resection of the prostate) TURP.  Pain is currently in month 17.,UNK
3967,I&#039;ve taken it for a week and I have had less anxiety in last couple of days.  I hope it continues to help.,UNK
3968,Works well for me but also gave me yeast infections.,UNK
3969,I have been able to swallow within 2 hours of taking my first pill,UNK
3970,Take 1200 MG once a day  makes me feel much more peppy.,UNK
3971,Had great results with this medicine.,UNK
3972,"The worst experience ever. Deep depression and I&#039;ve never had issues with depression in my life. 
I was seriously a mess.",UNK
3973,Immediate relief from vomiting/nausea.,UNK
3974,Just got on it - so far so good.,UNK
3975,"Did little to relieve spasms radiating through leg muscles from lumbar stenosis, which it was prescribed for.  Most notable effect was erectile dysfunction.",UNK
3976,I have been on Femara for 4 months. Hand pain and weight gain.,UNK
3977,I&#039;ve been taking it for 2 months with no issue. Also my cramps are not as painful.,UNK
3978,Have tried all else works fast. Tastes horrible!  Was the active ingredient in paregoric,UNK
3979,Take the shot once a month for knee pain. It helps a lot and I could feel the difference in just hours.,UNK
3980,No effect. I thought it must be a placebo. ,UNK
3981,Made me sick,UNK
3982,"Awesome, nothing has worked til now!",UNK
3983,I&#039;ve been taking Sildenafil Generic name for Viagra about a year now and it actually work better for me! ,UNK
3984,"The taste makes me gag and after every time I take it I feel nauseous but after taking it for 5 days I feel so much better, it was worth taking",UNK
3985,I have had difficulty going to sleep and was prescribed this medicine. It does help me sleep for several hours.,UNK
3986,Best thing out there today built to fight the crave completely. Smoke free for more then a week and it&#039;s never been easier,UNK
3987,It works well- it&#039;s brand is different than the generic.,UNK
3988,I have had GERD for many years and have tried everything. Prevacid works the best. I take 30 mgs a day. ,UNK
3989,"Very effective at relieving symptoms, but my husband and I both are experiencing insomnia and some anxiety with it.",UNK
3990,Lithium works wonders to stabilize my mood. Only negative is some hair loss and acne.,UNK
3991,it&#039;s very a good medication to relief the pain.,UNK
3992,Worked better than expected by a long shot.,UNK
3993,Helped for several years but effect stopped recently and I had to switch,UNK
3994,I never had problems with this medication.  I don&#039;t take it when I don&#039;t need it.,UNK
3995,"Works great, but watch for weight gain.",UNK
3996,"Although my labwork returned an ever-increasing positive note for the duration of the treatment, 3 months after treatment indicated I am one of the 4%.

Statistics be damned!",UNK
3997,I have had all three shots. I found out that my knee hurts worse than it did before getting the shots.,UNK
3998,Helps control my blood pressure with no noticeable side effects at the 240mg/day dosage.,UNK
3999,Caused me more pain but has helped others.,UNK
4000,Lately this medicine has given me stomach pains which are very uncomfortable and I&#039;ve also had the feeling like I need to use the bathroom,UNK
4001,"I was on this medicine for two weeks,  i felt fine even a little happier,  but for 3 days straight I went into a major depression, I have stopped taking it.",UNK
4002,I&#039;m on my second pack of this pill and its been not so good for me I&#039;ve been constantly getting yeast infections.,UNK
4003,Love it.,UNK
4004,"Have been on Copaxone for almost 10 years, not one problem with the medication. Copaxone has improved my day to day life.",UNK
4005,This medicine didn&#039;t help me at all. As a matter of fact it made my neck muscles seize up.,UNK
4006,Best sleep medicine.,UNK
4007,It&#039;s expensive but works. To bad my insurance won&#039;t cover it.,UNK
4008,15 minutes after taking I would get severe leg cramps for hours. It made my good cholesterol bad it did not work for me.,UNK
4009,Very fast weight gain. I have been on these pills about two months now and have gained 15lbs,UNK
4010,Only pill I can take just one of and it work,UNK
4011,This medication clears up the little watery blisters (caused by Dyshidrotic eczema) in one (or maybe two nights flat.,UNK
4012,This works great after thoracic surgery.,UNK
4013,"I find it gets me to sleep, but my eyes are red and sore a lot of the time. Thinking of halfing my dose but been on it for 6 years now",UNK
4014,"Worked great for ADHD! Did cause migraines to be more frequent and is expensive, but does do wonders for inattention.",UNK
4015,Eyes still swollen and itchy,UNK
4016,"Lortab, best pain medicine ever, if I have to take anything for pain it would be this.",UNK
4017,"Vicodin works for me after hernia operation, once in morning and at bedtime.",UNK
4018,Stops the hunger craze..have lost 20 lbs in 3 mths..no side effects..best wt.loss drug i have tried.,UNK
4019,This medicine does an excellent job of lowering blood pressure but does a poor job of lowering pulse rate trying to lower atrial fibrillation.,UNK
4020,Aleve really worked for me with my toe swelling for the gout and  the relief was  very fast for me.  It is Awesome,UNK
4021,I could see its very faint effect on me though I tried it 5 - 6 times. Not really useful.,UNK
4022,"6.25mg of this product 2 X daily, reduced my 160/120 BP to 120/78 in two days.",UNK
4023,I got chronic pancreatitis and this serious GI disease and dilaudid has worked wonderful treating me of these problems.,UNK
4024,Have been on Votrient  about six months. Virtually no side effects except for the white hair. Tumors are stable.,UNK
4025,I still take ibuprofen daily on top of the Mobic.,UNK
4026,This medications is pretty good! Works well for mild to severe pain.,UNK
4027,I was prescribed to use this product every 4 hours it helps me especially in the morning and during the day,UNK
4028,"I take 30mg. It calms me down, I&#039;m less anxious. It does what it is supposed to.",UNK
4029,I&#039;ve gained alot of weight,UNK
4030,My doctor gave me this for a sciatic nerve issue I had for months. It is the only thing that worked.,UNK
4031,"Very Dry mouth, does not seem to help much, still have depression.  Plus the constipation is bad.",UNK
4032,Azor 5/20 has been excellent for me with no side effects at all and has controlled my blood pressure wonderfully.,UNK
4033,Great for dental pain. Toradol was better than the narcotics prescribed (Lortab) for managing the pain.,UNK
4034,Taking 50mg&#039;s at night and I still get up 2 x&#039;s a night and my mouth gets very dry.,UNK
4035,Great medicine. It works perfectly and I don&#039;t feel like I need to increase dosage over time.,UNK
4036,Did not work on my pain,UNK
4037,"Very affective for anxiety, but made me so tired I had to switch.",UNK
4038,I feel extremely tired and I have mood swings but it really helps me feel less sick and I&#039;ve stopped constantly gaining weight,UNK
4039,Works well for managing blood pressure with no noticeable side effects. It is expensive compared to generics though. Current price with insurance discount is about $57.,UNK
4040,This is the best medication ever. I have been using it since 1999.,UNK
4041,"This worked great on my sinus problems, however, it caused such horrible back pain that I had to quit taking it.",UNK
4042,The best sleep and no side effects,UNK
4043,"Get out of breath easily without any exertion, tired and can fall asleep just sitting in a chair, swelling of feet and ankles.",UNK
4044,I got pregnant while on this damn Xulane patch. Not effective for me at all..,UNK
4045,This did not work at all,UNK
4046,"Not as many side effects as other antidepressants, such as Celexa.",UNK
4047,It&#039;s Mirena. Don&#039;t get it.,UNK
4048,The patch lessened the pain I was feeling in my shoulder/back area.,UNK
4049,"I love this medicine. Besides using it for sleep, I also use it for fibromyalgia. 15mg in the morning.",UNK
4050,Fantastic results! But tried to stop them twice and acne came back after few month :( so had to start again,UNK
4051,It hurt each time I got the shot. The pain would be there for a week or so. ,UNK
4052,"This medicine did not touch my pain, and it gave me insomnia as well.",UNK
4053,"This patch is way to expensive, and doesn&#039;t last the week.  Falls off before time to change to a new one.",UNK
4054,This medicine is not strong enough for major anxiety problems related to post traumatic stress disorder. At 60 mg per day it hardly takes the edge off.,UNK
4055,"This pill is awesome, helps me sleep.",UNK
4056,Causes really dark thoughts.,UNK
4057,"These eye drops helped with itching, swelling and discharge within 12 hours. The redness of the eye persisted longer.",UNK
4058,Terrible flavor!  Works good if you can actually finish the first dose.  Dreading the second dose!!,UNK
4059,Injections are always unpleaseant but the results are great.,UNK
4060,So far not working for me. I have only taken 2 doses at 15 mg.,UNK
4061,"I had back surgery and have nerve damage, so when pain starts with the nerve down the leg, I take this medicine and it works wonders.",UNK
4062,Two bottles of water and a can of tonic water later and my heartburn is RAGING. Don&#039;t lay down after taking this medication. ,UNK
4063,"I&#039;m having a lot of fullness and sharp pains in my stomach, and also have constipation.",UNK
4064,I am glad I finally found something to relieve my dry eye pain in the summer months.,UNK
4065,Works well if you can tolerate the annoying cough that is a common side effect of this medication!,UNK
4066,Great for short term pain relief as far as long term the withdrawal makes you wish you never started taking and could manage pain without it only if nessesary. Follow directions.,UNK
4067,Felt normal in 24 hours,UNK
4068,"Very effective for me with both nausea and diarrhea.  Works well at preventing vomiting, in my experience.",UNK
4069,Worked for a short amount of time when use with Retin-A,UNK
4070,"Robaxin works great for me but only for short periods of time. I am on for 3 weeks and then off for 1 week. 

",UNK
4071,Works right like it said it would but heavy bleeding.,UNK
4072,This is a excellent medication I have lost 53lbs only on the injection alone know more hbp or know  more diabetes at all the is a wonder drug...,UNK
4073,The only drug that works for me,UNK
4074,no more swollen feet and ankles,UNK
4075,Fast acting relief felt in the first day,UNK
4076,"I&#039;ve had mine since April and love it. Other than longer and heavier periods, it is great",UNK
4077,I have used this drug since the 1960s.  It is the best thing on the market for allergies or the beginning of a cold.,UNK
4078,"Sometimes use it. Really good effect, my wife happy! Erection is very strong and long, and absolutely no side effects for me.",UNK
4079,Works well without any side effects.,UNK
4080,Bad after taste . Too fishy,UNK
4081,Works good definitely helps stay asleep. Can make you a little dizzy.,UNK
4082,Been taking this medicine for two years with no outbreaks and no side effects. It&#039;s been life changing.,UNK
4083,"I just started taking it last week and have not noticed any difference yet.  It&#039;s expensine, even with my insurance.",UNK
4084,Works great on pain. I would be bedridden without it.,UNK
4085,Have suffered all my life with IBS. Not diaganosed until 25. Librax saved my life.,UNK
4086,very helpful for me. Some anxiety the first couple of months but none now. I havent breathed this well in years and have the results to prove it.,UNK
4087,This medicine did wonders for me.,UNK
4088,It seems to have my bi-polar condition under control it helps along with the medication celexa. I have found my moods not swinging as much.,UNK
4089,"Botox, in short, gave me my life back.  It&#039;s literally a life saver.",UNK
4090,Experienced upset stomach and diarrhea - not much in the way of relief for hip and shoulder pain (possibly arthritis or bursitis).,UNK
4091,I found this in Amman Jordan while traveling. The first thing I found that helps migraine symptoms. Can&#039;t find it in USA.,UNK
4092,"This drug is so expensive (insurance covers little!!!) and simply does not work (after three months!)!
I do not recommend it to any one 
",UNK
4093,Tetracycline along with Flagyl and Bismuth in large doses for 2 weeks cured my H-Pylori.,UNK
4094,"1 Pill - rash on hands, arms, back, face and lips, discontinued use.",UNK
4095,Only medicine that no side effects. Take as when required basis and have no issues.,UNK
4096,"Taken for years battling anxiety, quite helpful if taken at onset of attack;  bottom line-exercise for me is better!",UNK
4097,So I recently found out yesterday I had the infection after having a miscarriage,UNK
4098,"I love this pill but,  I have felt very angry.  Not sure if the pill is making me PMS or not.",UNK
4099,"This cream is awesome, my daughters arms look beautiful. I used it twice a day for about 3 days and her arms cleared up.",UNK
4100,Fell asleep fine but woke up after a few hours. Bad taste in mouth and nausea,UNK
4101,My daughter has been suffering from severe dermatitis for several years. Our doctor recommended Elidel and surprisingly her dermatitis cleared in 2 days.,UNK
4102,If you like to bleed all the time use Nexplanon.,UNK
4103,Lower back pain: not helpful,UNK
4104,"First injection worked for maybe two, three days.  Second injection, knee hurt much worse.  Dr now recommended seeing a surgeon.  ???",UNK
4105,"Works great. Clear mucus and nasal congestions, I can finally breath, and lasts about 10 hours.  Very effective",UNK
4106,Seems that the side effects from the Paxil were worse than the stress or anxiety.,UNK
4107,I have taken Wellbutrin SR for about 8 months and I can tell a great difference between the brand name and the generic. ,UNK
4108,Very effective medication. I take 3 a day a feel great.,UNK
4109,The best over the counter pain reliever I&#039;ve ever found.,UNK
4110,"Had little effect on Benign Prostate Hyperplasia symptoms.
Dosage 1mg at night.",UNK
4111,I took it for nerve pain on my back. Did not help at all. No side effect for me.,UNK
4112,"Extremely effective until I developed a tolerance. Unfortunately, it was accompanied by &quot;sleep-shopping&quot; on Ebay.",UNK
4113,Ritalin excellent medication boost ability to focus (minus  out thoughts which bounce off each other at 0-60 second speeds) Quite calming.,UNK
4114,it works,UNK
4115,Treating patients with manic episodes I often prescribe Risperdal Consta. It works very well.,UNK
4116,"cured my acne, caused permanent tinnitus and visual snow. still suffering four years later. stay away.",UNK
4117,"My biggest complaint about this pill is that my sex drive  has disappeared. Also I feel somewhat more emotional on this pill, and my breasts feel huge.",UNK
4118,I took chantix  for about a month and a half and quit smoking. I had been smoking for over 30 years.  That was over 11 years ago,UNK
4119,It worked very well with no side effects.,UNK
4120,My son has done a complete turn around since he has began taking Vyvanse.,UNK
4121,Horrible side effects.,UNK
4122,"This drug has been life changing.  Over the past 6 months, I have lost 35 lbs. I tried Saxenda after all else failed",UNK
4123,This medicine is not to be taken lightly.  It helps very much. ,UNK
4124,"Minor side effects, worked great.",UNK
4125,MiraLAX is working well but it takes to long to work.,UNK
4126,I have been on Plavix 75mg one a day since September 2008. I have not experienced any problems that I can identify.,UNK
4127,This is the only medication that worked after trying others for several months.,UNK
4128,Works best for pain.,UNK
4129,Mild relief for lower back pain.,UNK
4130,I experienced mood swings and anxiety due to this prescription ... would not recommend.,UNK
4131,only antidepressant that works for me,UNK
4132,Been taking 320/12.5  one week. BP is still all over the scale. The only thing I have noticed is I have really strange dreams.,UNK
4133,Take action worked for me!,UNK
4134,It works for me. Years of PMT now I feel normal.,UNK
4135,"Tried many other medications (Paxil,Zoloft,etc) for anixety and OCD and this was a life saver",UNK
4136,Really relieved stiffness and took edge off the pain.,UNK
4137,Amazing made me sleep the whole night while I had insomnia. I give it a 2 thumbs up,UNK
4138,I have lost 50 lbs since 8/08/13. No bad side effects. 30 lbs to go.,UNK
4139,"This is the ONLY cough medicine that works.  Nothing else allows me to rest, therefore, allows me to get better.",UNK
4140,Thus worked for my constipation. .but made all of my muscles ache.,UNK
4141,It helped me with all my hallucinations. I stopped hearing things more. I still went through disturbed racing thoughts though. Shakiness still occurs.,UNK
4142,I love the remeron...It gave me back my life.,UNK
4143,"Was on this for so long and once getting off of it, I had a hard time getting pregnant",UNK
4144,Tried it for a month. For me it was ineffective.,UNK
4145,This is my third month using this birth control. I love it it&#039;s amazing no bad side effects at all its serving it purpose 100%.,UNK
4146,Useless.,UNK
4147,I was on 40mg for months and I noticed absolutely nothing.,UNK
4148,pretty radicle pill - my boobs went from an A to a DD no weight gain and I seem to be a lot happier now I love this pill!!,UNK
4149,I take 1 mg every night and I am finally able to sleep well and wake without feeling drugged.,UNK
4150,Works quite well for me. No major side effects. ,UNK
4151,Much more effective than Cipro.,UNK
4152,Side effects lightheadedness and tired,UNK
4153,I have tried a lot of medication for restless legs syndrome and tramadol is the only thing that gives me relief.,UNK
4154,"This is a very old, and very under-rated pain medicine with very few side effects.  It has been the wonder drug for me!",UNK
4155,Short term memory dysfunction and concentration problems.,UNK
4156,"I have been taking Effexor since it first came out.  It is the only drug that has helped me, life has been good.",UNK
4157,"this worked in beginning-then gave me insomnia, restless leg syndrome, shakes and more angry.  It could no  longer take it ,I had to get off.",UNK
4158,The leg aches were the worse I have ever had and even went into my hips!  I can&#039;t even sleep they are so bad!,UNK
4159,Love this pill. All birth control pills cause side effects but this one is the best for me. A nice plus was fuller breasts.,UNK
4160,"I have seasonal allergy since the age of 11, and have tried everthing on the market. Only Periactin has helped.",UNK
4161,5 years,UNK
4162,"I used this in the hospital after I had spine surgery. I used it with morphine, and it seemed to help a lot.",UNK
4163,Works better with the diuretic hydrochlothiazide.,UNK
4164,No side effects.  Blood pressure fairly well controlled on 5 mg of this only.,UNK
4165,Been taking for 15 yrs. Started as antidepressant but also helps back pain and sleep.,UNK
4166,This medicine is very good. It really is effective. The side effects are tolerable. I would strongly recommend that the directions are followed by the patient.,UNK
4167,I also take Klonopin for Bipolar and Panic Disorders.,UNK
4168,Unsure of the best time to take this medicine.  Seems to work best for me in the morning.,UNK
4169,"I am on a lot of medication, but thanks to the previous comment, it may be the Pristiq that is causing my constant hot flashes!",UNK
4170,Works miraculously on a cough.  Be careful of the side effects.  Makes me somewhat woosey and dizzy.  Use only when desperate for relief.,UNK
4171,"Very effective to me. Considering, greatly suppressed seizure frequency and low interference from side effects.",UNK
4172,Works for the first time . Don&#039;t work 2nd time you get it.,UNK
4173,This is incredibly overpriced garbage!,UNK
4174,So far I&#039;m losing weight only be using for a week.,UNK
