,0,1
1406,This was my first birth control pill ever and the only thing I noticed was that the day I was supposed to start my period I was very mean and irritable.,UNK
1407,It works.,UNK
1408,Very effective with no side effects.,UNK
1409,The draw back to this medicine is dry mouth and night sweats,UNK
1410,"Awesome &ndash; back from the dead after only the 2nd day.
Great stuff",UNK
1411,For short term treatment of obesity there is no doubt this is hands down the best thing on the market. ,UNK
1412,"Combined with ibuprophen, my pain is lessened enough to carry on household chores and to pursue my hobbies.",UNK
1413,After a couple of days of taking it twice a day I started crying all the time and everything got worse. I called the Dr and they said stop taking it.,UNK
1414,"Terrible leg and knee pain , the drug worked great in reducing my bad numbers but the pain is not worth the results",UNK
1415,Xyrem gave me the ability to return to work with the use of stimulants during the day.  Stimulants alone would did not work.,UNK
1416,The only side effect I&#039;ve experienced is sleeplessness.,UNK
1417,"5 stars!!! Acne gone, my hair is stronger and shiny!!!",UNK
1418,"Fixed my heavy, irregular periods. Bonus-my skin cleared up too. Zero side effects.",UNK
1419,I have not felt this happy and normal in a very long time. Do feel shaky about once a day but worth it to feel happy again.,UNK
1420,"Insomnia, nausea",UNK
1421,Excellent drug for back pain. Generic does not work as good as the real brand Cataflam.  ,UNK
1422,"really helped, worked fast. I took it with food, without food gave a sour stomach. Helped me to sleep, too.",UNK
1423,"Too expensive, caused depression and restlessness, caused nightmares every night.",UNK
1424,It worked great but made me really dizzy. Has anyone experienced this?,UNK
1425,"Very very good for meetings, interviews. Stops the impending doom feeling...!! Amazing",UNK
1426,"ankles may swell if no exercise and possible nasal stuffiness and swelling.
Very effective in reducing b.p.",UNK
1427,"I have been taking Adipex P for 3 mouths and I have lost 30 pounds.
I only take half a pill in the morning. It works very well.",UNK
1428,Switched from Lexapro to generic escitalopram. Big mistake. Suicidal after 3 weeks. No problems for many years prior.,UNK
1429,"This is a big step up from golytely, the taste is better and even better yet only 2 small bottles not 1 gal.",UNK
1430,Ruined my life,UNK
1431,Effective in reducing blood sugar level for 5 to 8 hours.,UNK
1432,Very good when pharmacy can get it. Several times months will go by and unable to get.,UNK
1433,Don&#039;t take on an empty stomach!  Always works great for me!,UNK
1434,Saved my life and my family recommend Suboxone to anybody who&#039;s addicted to opiates.,UNK
1435,I&#039;m on my second script. I still have gastritis so I&#039;m not taking it anymore.,UNK
1436,Every time I take the echinacea tablets I develop a severe headache within a few hours.,UNK
1437,Works fantastic.,UNK
1438,Exacerbated all negative feelings.  Switched to Effexor worked much better.,UNK
1439,Well a good medicine if taken in time to stop pregnancy but the side effects it hurts.  I had cramps and headaches which are terrible for me.,UNK
1440,"Works good, but the withdrawal is bad.",UNK
1441,Helps with restless extremities aiding falling asleep.,UNK
1442,"Don&#039;t stress it works, maximum effectiveness under 24 hrs, total life saver, it definitely is worth the $50",UNK
1443,"I had a positive  experience , was effective",UNK
1444,Better than Ritalin. ,UNK
1445,this drug works great on panic disorder.It calms me down alot. It is addictive the only downfall.,UNK
1446,Adderall IR had the same duration of action as Adderall XR for me. Both of them only had lasting effects for four hours and then quit.,UNK
1447,"After a couple of days using Advair my mouth has become sensitive. I like hot foods but now, just a drop of Tabasco makes my entire mouth burn. ",UNK
1448,This medicine has helped my son be able to control his impulse decisions and helped him be able to go to school and do homework.,UNK
1449,"Took for 7 days, twice daily at 250 mg. This medication did nothing for me, still have my UTI.",UNK
1450,Cures tinea versicolor with  twice daily use for 3-4 weeks.,UNK
1451,"This drug has been more effective than Axid,, Acefix and Prilosec",UNK
1452,"Did not seem to notice much improvement, was on it for probably 8-10 wks.",UNK
1453,I&#039;ve used this for about a year and a half with no interactions with other drugs. It&#039;s fairly safe. ,UNK
1454,Its been 5 weeks since I had my 3rd injection I still feel sharp pains every 3rd step but no where near the pain I Had.,UNK
1455,very helpful and good drug. It reduces my heavy period and no pain at all. I can work and not scared of getting soak....,UNK
1456,Made me feel a lot better and able to walk further and do day to day things.,UNK
1457,Use after several years resulted in significant hair loss; had to discontinue due to this uncommon side effect.,UNK
1458,Has no noticeable effect. I still need to urinate slowly and patiently several times nightly.,UNK
1459,Worked fast and had no side effects.,UNK
1460,I think that this medication is a wonderful drug. I love it couldn&#039;t do the things I do today without it!,UNK
1461,"The medicine works great but gives me headache, diaharrea, and nausea upon waking.",UNK
1462,This worked wonders for me.  Seasonal adjustment may be needed as it is with me.,UNK
1463,This cough medicine is AWESOME for the nagging cough that comes with bronchitis.  ,UNK
1464,"Simple, lost 32 pounds in four months. Never felt better.",UNK
1465,I take it in the morning and with the help of my Dr. my numbers have been stable.,UNK
1466,Although this drug is effective for pain; I experienced horrible withdrawls from it.  I was awake for over 30 hours.,UNK
1467,Relafen always gives me bloating and gas.,UNK
1468,Amazing. Worked over night to moisturize my psoriasis on my knee!,UNK
1469,Restless legs was a main side effect for me.,UNK
1470,was very helpful in the control of my diabetes and was very easy to use...no needles was refreshing...I will continue use,UNK
1471,Keeps me from tossing my co-workers down the steps.,UNK
1472,They say in the packet that there may be some spotting but I&#039;ve had my period for over 6 months on Implanon.,UNK
1473,Helped with anxiety but made me hungry all the time (no other side effects) but I was able to sleep well while taking it.,UNK
1474,I have been on prozac 10mg for 6 days and no change. When will I feel better?,UNK
1475,It works well considering I didn&#039;t get pregnant.  My issue was I gained 30+ lbs and I was on it less than 1 year.,UNK
1476,"I am taking for prophylaxis of shingles with chemotherapy treatment. No side effects, one of the easier pills to take.",UNK
1477,"Week 4 and only feel a little confused in the mornings as a side effect, it&#039;s working fantastic for me",UNK
1478,Saved my life.,UNK
1479,NovolinN works for me and is cheaper than Lantus. No adverse reactions and identical results. ,UNK
1480,"After using this it gave me a severe headache, leg muscles strains, limbs ache for at least 1 week.",UNK
1481,Side effects had a tremendous role in decreasing quality of life.,UNK
1482,Hot flashes throughout the day; moodiness and moderate depression and moderate fatigue.,UNK
1483,First day using woke up in the morning and it&#039;s still very itchy? Normal?,UNK
1484,A wonderful drug! I can sleep at night now. It also stopped my mood swings which were rapid cycling. I feel really good on it! Would highly recommend it!,UNK
1485,Very good,UNK
1486,"Good all round pain reliever, some break out pain, cured by occasional Tylenol 3",UNK
1487,Really helps my mother.,UNK
1488,Great ..years of use.,UNK
1489,"I used this as my son had conjunctivitis and after one day the redness and swelling went down. Good eye drops, would definitely recommended to all.",UNK
1490,I was prescribed this medication for food poisoning. Effectively reduces nausea. I experienced no vomiting on this pill. Did experience mild headaches and slight drowsiness.,UNK
1491,"I take it with a banana so I can&#039;t taste it, no effects except for headaches.",UNK
1492,My daughter has inattentive ADHD.,UNK
1493,It&#039;s the best for back pain...absolutely the best!,UNK
1494,I am trek leader. I am 100% confident to use Dimox to prevent the Altitude illness. This drugs makes my job easier. Thank you.,UNK
1495,IM injections of Reglan helped to relieve my nausea and vomiting that resulted from serious side adverse effects from an antibiotic.,UNK
1496,I started out with the lower dose it did not work so I was put up to the highest dose  it still does not seem to work what do I do,UNK
1497,Does nothing may as well take sugar pills,UNK
1498,"I am feeling so frustrated. I have developed a tolerance to Seroquel, and nothing else works for sleep. ",UNK
1499,I am hyper can&#039;t sleep,UNK
1500,"Lamictal handles most of my symptoms, but I continue to deal with money issues and relationships.",UNK
1501,"Awesome, Awesome. Have had it for 2 weeks now. No problems thus far. Actually lost 4 lbs, went from 127 to 123lbs.",UNK
1502,Back again.  As of 8/28/14 my viral load is down to 34. My CD4 is climbing as well.   No side effects anymore at the time.,UNK
1503,I started my first dose at 37.5 mg today. I have felt 0 change is this normal?,UNK
1504,Very effective for pain after my back surgery.,UNK
1505,This medication gave me my life back. It truly does help with panic attacks.,UNK
1506,It gave me panic attacks.,UNK
1507,Excellent and I love that it increases my appetite since I have a hard time eating. Helps calm me so I can sleep.,UNK
1508,I have this scorching pain in my legs and this is the only new med?,UNK
1509,It&#039;s works but my child doesn&#039;t like the bubble gum flavor. Will be trying something else.,UNK
1510,Works best for pain.,UNK
1511,4 years and successfully no baby! Now....how to have a baby with the person I want one with!!,UNK
1512,Sleepiness memory loss.,UNK
1513,I have been having headaches for about five months and the doctor prescribed me Fioricet and it does nothing for my headaches.,UNK
1514,This medicine reduced the pain but immediately caused severe swelling of the legs and feet.I also had constant dizziness.I could not tolerate the swelling and weight gain.,UNK
1515,For me Rituxan has been the best medicine yet. I have been through Enbrel and Humira which helped but began to lose their effectiveness after awhile.,UNK
1516,I used Advir for years...then it started doing less work. Doctor gave me Symbicort and wow what a difference.,UNK
1517,Horrible!  If you want constant spotting to bleeding..depression and hair loss...this will do it!  This causes hair loss.,UNK
1518,"Less agression, no weight gain, no increased appetite,  taken 5mg for 8 months.  Happy, normal,active life now.",UNK
1519,Tend to have dreams while on this drug.,UNK
1520,it does help,UNK
1521,Was almost instant relief and only used it for a day to stop a long nagging cough. I get it every winter.,UNK
1522,Metamucil works if you use it everyday. I just can&#039;t stand the taste of it.,UNK
1523,This med stopped my pain for longer periods of time.,UNK
1524,"Absolutely terrible experience on tirosint - landed in ER with chest pains, dizziness, extremely disoriented.",UNK
1525,This medicine helped for fibromyalgia but caused hallucinations and fatigue.,UNK
1526,I took the two pills at one time and didnt have any problem with it. It has been 5 days since i took it and i feel fine.,UNK
1527,Tastes great.,UNK
1528,"Well there isn&#039;t a cure, but this sure helps.",UNK
1529,I have had minimum side effects.,UNK
1530,Its awesome .... Lessened my problems upto 70,UNK
1531,This medicine helps me a lot. I have also found a good side effect from the drug. I feel much better and more active and motivated.,UNK
1532,"My daughter takes Lamictal. At first the doctor had to increase the dose, but now she is okay and no seizures at all for about nine months.",UNK
1533,I have been taking fioricet for about a year now for migraines. And it works great,UNK
1534,So far this is one of the best medications that I have tried for my headaches.,UNK
1535,I personally love it. Great stuff,UNK
1536,I%u2019m 37 and I had been suffering from panic disorder since I was 25 and this works great for anxiety.,UNK
1537,Undetectable after one month. Finishing 2nd bottle    Had all the common side effects,UNK
1538,"I got diarrhea, headache, muscle ache, flu like symptoms.",UNK
1539,Works great. Love it.,UNK
1540,Terrible burning and swelling occurred.  The pain was worse then the infection itself.,UNK
1541,wow!,UNK
1542,"Works great, almost immediate.",UNK
1543,This medication helps with my symptoms and controls some of the voices and the sightings that I experienced throughout my use of this medication.,UNK
1544,I had a blocked tear duct with inflammation and this worked almost instantly after trying other drops.,UNK
1545,Vicodin was prescribed for my shoulder pain. After taking the medicine for 3 days without relief of my shoulder pain I quit taking the medicine.,UNK
1546,"Been taking it for more than 2 years. Keeps hot flashes away, and also psychic break downs and panic attacks.  Great medicine. ",UNK
1547,I take tramadol for back pain and to help sleep if need be. ,UNK
1548,"Easy to use, no side effects experienced as opposed to interferon b medication. Good support program and co-pay assistance. Has lessened progression",UNK
1549,Thus worked for my constipation. .but made all of my muscles ache.,UNK
1550,Works well. Popular brand.,UNK
1551,First pill down and thrown back up in under 1 hr,UNK
1552,It is the only drug that works for fibromyalgia.,UNK
1553,Took Moviprep and 5 hours later nothing has happened. Ready to go to bed. Have to take again at 6am,UNK
1554,Very good results.  My skin has not looked this good in a very long time.,UNK
1555,"I got this medicine last month, and am now start to getting good results.",UNK
1556,This has been an amazing contraceptive. My girlfriend is really happy with the results and I find it to be very effective.,UNK
1557,My scores went from -3.9 to a -1.08.,UNK
1558,Workedad wonders!,UNK
1559,This medicine is the bees knees.,UNK
1560,"I gained a lot of weight and had a significant increase in headaches. It left me feeling moody, tired and unbalanced.",UNK
1561,"Had an allergic reaction: shortness of breath, uncontrollable shaking, dizziness, near fainting, headache, fast heart rate. ",UNK
1562,This medicine works better than any other allergy medication with decongestion that I have ever tried.,UNK
1563,It worked for a while then it stopped working a few months later,UNK
1564,Got pain gone,UNK
1565,"Effective for mild pain, not very effective for more moderate to severe pain.",UNK
1566,Causes intense sweating,UNK
1567,"The very first night I started Requip, I vomited violently all night.",UNK
1568,This drug is not listed for the cancer symptom of not eating and should be. It saved my family members life.,UNK
1569,"My grandson is not as restless, and is more lovable now that he is not taking the Vyvanse medicine he was on. ",UNK
1570,Does not open lungs and does not assist when needed.,UNK
1571,"Cold Symptoms - It helped a lot but not for a long period of time, but it did help.",UNK
1572,Very good medicine. Been taking it for a year with no side effects.,UNK
1573,"Works great for deep vein thrombosis! However, I always experience heavy bruising at the injection site.",UNK
1574,Helps a lot but causes severe drowsiness.,UNK
1575,"It may include some side effects, I used and 
I prefer Parnate with some side effects vs depression that&#039;s my experience.",UNK
1576,It helped greatly in reducing my nerves after weaning off of Soma.,UNK
1577,Used Fleet 5 minutes later all came out.,UNK
1578,"It helped a lot. I was deep down, now I feel almost normal.",UNK
1579,This caused severe headaches sore breast and emotional outbursts. Rather have flushes,UNK
1580,"Wonderful, best thing ever to happen to me.",UNK
1581,Absolutely brilliant medicine....... I live again.,UNK
1582,It is good for mood stability,UNK
1583,Makes me mean. Hostility sets in and have to take a nerve pill.,UNK
1584,"Worked for a couple of weeks,  then not so much!!!",UNK
1585,"Caused me to have hives, can&#039;t take it.",UNK
1586,13 year failed back surgery patient. Just winged off methadone. Received no relief from Ultram ER 300mg at all!,UNK
1587,Works pretty well,UNK
1588,Taking this 4x a day for my second bout with Cellulitis. Also taking Ultram for pain.,UNK
1589,It will probably stop working at some point to help you fall asleep. It did for me.,UNK
1590,Quit on the 8th day of taking Chantix. 14 days since my last cigarette.,UNK
1591,"I had no noticeable negative side effects, and was able to function in a normal way without feeling like it was forced.",UNK
1592,Wasn&#039;t effective,UNK
1593,"The sun came out when I started taking this medicine. I started singing in my car, striking up conversations with strangers and being a better mom. It changed my life!",UNK
1594,tolterodine hasn&#039;t controlled my incontinence. I have less control concerning being able to hold my urine till I get to bathroom.,UNK
1595,"I had no effects, I actually had more pain and no effects on the swelling",UNK
1596,Was offered one of three?  But so glad I decided on three.  My knees have never felt the same.  Great product!,UNK
1597,I have been on Zoloft for 14 years now. It changed my life. It has stopped my panic attacks. ,UNK
1598,"It helped with the Pain, but caused severe dryness, itching, and cracking of my skin. Especially on the Hands.",UNK
1599,After 3 days infection is not getting better.,UNK
1600,Horrible!  ! ! The stomach pain is like going into labor.  But it WORKED .,UNK
1601,so far I have had some stomach cramping but at least the doctor in the hospital told me what to expect I&#039;m getting better,UNK
1602,Abdominal cramps with diarrhea and nausea.  Will tough it out this time but if I get another infection will definitely ask for a different antibiotic.,UNK
1603,"Although this drug was very effective in curbing my 11 month old sons vomiting and diarrhea, it caused him to have very hard stools.",UNK
1604,I take 120 mg at night but it takes approx 6 hours to start working &amp; is completely worn off approximately 16-18 hours after dose.,UNK
1605,It worked the first few nights. After that it ceased to be helpful at all.,UNK
1606,My face breaks out in itchy blotchy spots and I never sleep,UNK
1607,"Had a headache from drinking the night before.  Took 6mg Dilaudid, the pain was gone almost instantly.",UNK
1608,Relieved neck spasms and akathisia from antipsychotics,UNK
1609,Helped with the pain from an animal bite,UNK
1610,"Day 7 today not sure if its working or not, really am putting my hope into this medicine to help save me.",UNK
1611,just started,UNK
1612,Abnormal dreams and bothersome while taking sensipar.  I have difficulty sleeping . Bad dreams stop and return to normal if I skip the dose,UNK
1613,Tried all the benzodiazepines with no luck. Then they tried Buspar and it changed my life.,UNK
1614,"Brings me back from panic attacks, only thing that calms me down.",UNK
1615,It helps control break thru seizures and the anxiety I get with mine. However; it makes you feel feel very dopey and tired.,UNK
1616,This has helped me to control my glucose better than any of the medications that I have tried in the past.,UNK
1617,If your getting side effects  from taking prednisone try switching to Hydrocortisone tablets and see if that helps,UNK
1618,This medication helps me sleep all night. It is the best sleep medication I have ever taken.,UNK
1619,"I cant even tell I took it .
I feel it is not helping .
NO Symptoms",UNK
1620,It is a good medicine to treat certain mental conditions.,UNK
1621,"Worked well, but I got low blood sugar a few times",UNK
1622,Annoyed when they first gave me this but appears to be working well. Runs out fast though and dries out the skin a lot.,UNK
1623,"been taking Nplate for 4  years 
I take N Plate weekly . No side affects . Been keeping my count above 50 most of the time higher 
count is over 100,000",UNK
1624,I was on this one for several years and the longer I was on it the more tender and painful my breasts became.,UNK
1625,"No side effects. Long lasting (about 1 year), and was even effective for filling in my jaw line.",UNK
1626,"Been on for a month and totally love it. Skin is clear, no weight changes, and actually my mood is a little better overall.",UNK
1627,Good.,UNK
1628,I can lead a normal life-thanks to suboxone!,UNK
1629,I took this for 2 years and got a light wallet and lung cancer.,UNK
1630,This medicine really works. The only problem I occur was having a rash from eating Chinese food.,UNK
1631,Had zero effect except impotence. This drug is over rated.,UNK
1632,I have medicine and food allergies.,UNK
1633,Helped with cough but couldn&#039;t sleep and had very severe diarrhea.,UNK
1634,Ive been on contrave a little over a month. No side effects for me. Lost 15 pounds already.,UNK
1635,Best pain medicine made that helps.,UNK
1636,Very horrible experience on this medication that I took years a go. Side effects were not pleasant.,UNK
1637,Seroquel was prescribed for sleep disorder and it works just fine without any hangover the next morning,UNK
1638,I am 41 years old. I have been taking Boniva for the last 3 months with no side effects so far. Fingers crossed.,UNK
1639,I have increased energy but this drug has not improved any other postmenopausal symptom.  I am very disappointed.,UNK
1640,It helps take away your anxiety plus it helps you sleep too.,UNK
1641,I had severe hot flashes and within 2 days of taking pristiq they stopped completely - I am not kidding.,UNK
1642,"Thank God for plan b! After stressing for two weeks, my cycle finally came on!",UNK
1643,"Rapid improvement in red areas on neck, chest and elbows.",UNK
1644,Stopped smoking 6 days ago without the anxiety I usually get while trying to quit.,UNK
1645,So I just started taking these pills on last Wednesday and they took my weight and it was 198,UNK
1646,Keppra XR returned my life to normal.  Excellent medication for Epilepsy/seizures.,UNK
1647,"Doctor prescribed this for treatment-resistant psych condition, including post traumatic stress disorder. This medication is significantly reduced both nightmares and flashbacks.",UNK
1648,Works as should.,UNK
1649,Best method to cure panic forever.,UNK
1650,Works the best ive tried all types of sleep aids and doxy is the best and over the counter :),UNK
1651,Works great,UNK
1652,it is just a magic. it takes you back to the time you had never smoked...,UNK
1653,Have been using this medication since I was 10 year old. I am now 16 years old.,UNK
1654,"I took two cycles of Contrave  unfortunately 

It did not help me to lose weight at all.",UNK
1655,2 pills still itchy. Feel nauseated and have stomach cramps.,UNK
1656,Outstanding product. Works really well. Easy to use. Worth every dollar.,UNK
1657,"Fiorinal has helped my Migraines better than anything else I have tried.  I have not
had any side effects at all.",UNK
1658,Works great and fast.  Very expensive.,UNK
1659,Valtrex is the only one that worked for me. This the best and the only one.,UNK
1660,femhrt took away my hot flashes within a week but the acne was unbearable. Stopped taking it.,UNK
1661,"Didn&#039;t help symptoms at all.  

Side Effects:
1.  Really blurry vision
2.  Felt dead inside.",UNK
1662,"Cymbalta has been a life saver for my Fibromyalgia pain. I can function now, it is great.",UNK
1663,I find if you were on a birth control before Loseasonique you will already have the hormones in your system and will have less side effects!,UNK
1664,Works like a charm and I have zero side effects.  I feel much better.,UNK
1665,"If you take it at the onset of the migraine, it&#039;s a phenomenal medication. Saved my soul.",UNK
1666,It is a great medication I&#039;ve had no seizures and my back pain is little to none,UNK
1667,200 mg three times a day has been the only medication that help with facial and jaw pain. For me it&#039;s miraculous.,UNK
1668,Didn&#039;t work well for me at all. In fact it made my face even more red -even after I stopped using it.,UNK
1669,"I was given this for relief from a severe migraine in the ER, and it was a lifesaver. I was pain free after the second dose.",UNK
1670,This has helped me to control my glucose better than any of the medications that I have tried in the past.,UNK
1671,This medicine didn&#039;t help me at all. As a matter of fact it made my neck muscles seize up.,UNK
1672,Great treatment for addiction to opiates.,UNK
1673,OMG the horrible taste.  But it worked in 30 minutes then kept working for 4 hours.,UNK
1674,"I had triplets as a result of taking Clomid, they were all boys.  ",UNK
1675,"Chest pian was terrible and keep vomiting
Terrible anti biotic. Hate it",UNK
1676,Took this for 10 months. Finally switched to another medication since I didn&#039;t notice any benefits.,UNK
1677,"Didn&#039;t have much effect, only on occassion

I have kidney problems due to diabetes so Dr. put a stop on more than 30 days",UNK
1678,Helps a lot.  The anal itchiness and burning are mostly all gone.,UNK
1679,Made me feel worse like I was having a heart attack/panic attack. Too many side effect. No good.,UNK
1680,"I just wish I found Suboxone sooner!  8  months so far, hopefully many more to go!",UNK
1681,I tried this medication for 6 months with minor improvements. Side effects were erectile dysfunction and loss of muscle strength.,UNK
1682,it doesn&#039;t treat urinary tract infections .,UNK
1683,"Medicine is worse than the yeast. Burns and itchs after application. I have the three day pack, and this last day is no better than the first. ",UNK
1684,I hit my toe and half my foot swollen.,UNK
