,0,1
1234,My favorite place to eat! Organic delicious salads and pizza. Also has great gluten free options.,UNK
1235,"Yuck. I went there twice. Nothing memorable was served, other than pasta from a box. I would not return.",UNK
1236,They do not deliver. False advertising. Update your yelp profile and be honest with your customers.,UNK
1237,Quite possibly the dullest buffet in Vegas... I'll stick to the Rio and Bellagio.,UNK
1238,Exactly what you need after a night out.\nEggs and potatoes.,UNK
1239,"Not my cup of tea. Limited beer selection, stuffy ( name is accurate) and unwelcoming staff.",UNK
1240,"bad service , understaffed .... decent food",UNK
1241,This is CLOSED per note by the landlord.  FYI.  Go find the other location.  Still great drinks.,UNK
1242,Stale ice cream,UNK
1243,Their employees have such bad customer service. I stop going there. I drive to target now,UNK
1244,"Waste $$$ n time, cheap foods, only good services from a waitress.",UNK
1245,This is the slowest Starbucks I have ever been to,UNK
1246,"Food is excellent!  Their salads have decreased in size, but not price.  The service needs drastic improvement!",UNK
1247,This place sucks. Food has gone downhill majorly. Fun for drinking. Bad for food,UNK
1248,"this place never disappoints me. Tough to get in, reservations are a must but always delicious.",UNK
1249,"good Korean food, killer miso and seaweed salad - we'll be back.",UNK
1250,Went to have breakfast and no one showed up to open at 7am. No one showed up until well after 8am.,UNK
1251,Worst frozen yogurt I've ever had. 2 thumbs down!,UNK
1252,Beautiful Building and great area with lots of trees and seating to enjoy the area!,UNK
1253,Great Brunch!,UNK
1254,Excellent coffee. Comfortable atmosphere. Friendly baristas. Can't ask for much more.,UNK
1255,What was I thinking eating here?,UNK
1256,Did the easter brunch there.  Service was slow.  Food not good enough to visit again.,UNK
1257,I highly recommend this company for your auto glass.    They showed up on time and the technician did a great job.,UNK
1258,Great atmosphere with kind of an apothecary look. Good service. Quite a few craft beers on tap.,UNK
1259,Terrible food quality and very high prices.,UNK
1260,Good food  always hot and best of all $5.50 lunch special.Owner is great he gave soda for free,UNK
1261,Delicious ice cream and custard made on the Madison campus! Orange custard chocolate chip is a must have!,UNK
1262,"The food was great,cooked just how I wanted, staff was excellent and soda machine is a plus",UNK
1263,Friendly service. The hookahs are clean and smooth. Ambience is relaxing. Will go here again. Good customer service,UNK
1264,Great atmosphere! Wish the Outside Upper Deck were open on a more consistent basis.,UNK
1265,"We own timeshare here because of great service, nice accommodations, super pool, and good location.",UNK
1266,ehh its ok  not many flavors and not organic,UNK
1267,"Excellent environment,  and excellent service. Food is great and they have a good value for money.",UNK
1268,I should say you should check with the health dept before you eat here,UNK
1269,Disappointed. Sliders are all bread. Wings aren't good. Should've tried something more Mediterranean.,UNK
1270,"Consistently delicious sausages, whether uncooked or smoked.  I only wish the store wasn't so far away.",UNK
1271,Great anniversary dinner. Justifiably recommended by our friends.  Lovely and decadent. We loved it,UNK
1272,2 stars for not giving me a sample of my lobster ice cream.,UNK
1273,Closed after fire,UNK
1274,The ice cream is super cheap and very delicious! It's located in a pretty random gas station though.,UNK
1275,"Excellent food, great service.  The place is very small, so plan ahead.",UNK
1276,"Fast, friendly, quality food and *ahem* ambiance.",UNK
1277,"Management has definitely improved their service, menu, cleanliness. Huge improvement!",UNK
1278,Chris and the ladies did a great job with this diva.,UNK
1279,The worst service and food I have had In quite a while,UNK
1280,Quirky spot.  Great for a late night bite.,UNK
1281,Best PHO in Arizona!! Amazing spring rolls as we'll. please take the time to try this place:),UNK
1282,Ate lunch here. Was good!  Service was friendly,UNK
1283,"Delicious food, great service, reasonably priced and generous portions",UNK
1284,"Smaller than normal Starbucks, but plenty of parking.  Nice location in nice shopping area.  Staff was polite.",UNK
1285,Best sammies around. Very reasonable too.,UNK
1286,"I ordered 2 times from that place and got lazy service, late delivery and cold pizza and I do not recommend that place",UNK
1287,Super cute for couples. Some times can be a long wait.... Try the Mountain Oyster *side eye*,UNK
1288,Not amazing but not bad. I think it's a bit overrated but would definitely come back again.,UNK
1289,Best fast burger in town!,UNK
1290,Typical yogurt place. Nothing special.,UNK
1291,Great Place. But They need better Wings.,UNK
1292,Worst moving company of all time damaged just about everything never use them!,UNK
1293,Very informative. Lots of info by a very knowledgeable tour guide...presented in a fun way.,UNK
1294,Wi-fi rarely works. Parking bus system is slow and frustrating. The terminals need a makeover.,UNK
1295,My favorite place for dessert! Friendly staff,UNK
1296,The pizza here is good after a drunken night out in old town. It's just a bit greasy.,UNK
1297,"Great sushi, Great cocktails, Good Service",UNK
1298,Horrible.,UNK
1299,Racist mall management team same team that ran century 3 mall in to the ground stay away nothing good comes out this place,UNK
1300,every thing people say about the service is true. horrible...,UNK
1301,"Don't even waste your time! instead, go to El Pollo Loco a mile down Rainbow.",UNK
1302,This place was very sanitary! Good bang for your buck!,UNK
1303,"great fish, great coffee, don't order the fish if you aren't hungry!  good friendly service.",UNK
1304,"Arrived here on the eve of the New Year. 'Twas not too bitter, and delightfully twisted.",UNK
1305,So much fun! Entire family participated in Roc Challenge and loved it!!!!!!,UNK
1306,I like this place. Food is nothing special but the drinks are good and the atmosphere is cool. Good people watching.,UNK
1307,"The atmosphere is awesome, perfect for a luncheon with friends. The iced coffee is good and so are their sandwiches.",UNK
1308,Horrible. Bad service and the place is FILTHY.,UNK
1309,: /,UNK
1310,The food is super delicious service couldn't ask for better.... and the decor amazingly classy!,UNK
1311,"The place is very nice, but I was not happy with the food. It was only average but the price was not.",UNK
1312,Money Money... Money.. Nice place to play and stay,UNK
1313,I have had better pizza from the frozen section at the grocery,UNK
1314,Fresh. Great service. Super lunch specials.,UNK
1315,Small portion.... High price..,UNK
1316,"Go to chilis instead. I feel this restaurant is below average for fast food, at best.",UNK
1317,"was in line for 2 hours to check in, no explanation given for the ridiculously  slow service, a nightmare.",UNK
1318,Always good. My daughter loves it! Matthews location has great customer service!,UNK
1319,The place was decent and so was the food.  I especially liked the potato salad as a side dish.,UNK
1320,Completely charming. A true respite from the busy city!! I found something for the gardener that has everything.,UNK
1321,Music is awesome I always dig it,UNK
1322,You can't spell IT RIPS without Spirit!\n\nit's the worst ever!!!,UNK
1323,Good authentic Italian/ NY style sandwich.  Owner and wife are not the friendliest people.,UNK
1324,Meh. I've experienced better.,UNK
1325,"Best pizza in town, traditional ny style and they also have sicilan which is my favorite",UNK
1326,Fun place. Great view of downtown.  A lil tight on the parking. The french press coffee was fun...,UNK
1327,Do not come here if you want to have a some what decent time terrible servers and service,UNK
1328,"all i can say is, red robin, yum",UNK
1329,love love love this place.  i don't care about the wait.  love the food.  all very very yummy.,UNK
1330,The sandwiches are good as is the pizza...although a bit overpriced considering the quality.,UNK
1331,"Nice comic books store, not very friendly but have a variety of back issues.",UNK
1332,All I have to say about this place is that it is where my mom and my gf's mom like to go.,UNK
1333,Typical BofA but at least there is never a huge crowd here.,UNK
1334,The pizza is delicious and I love love love the wine coolers. The atmosphere is trendy but relaxing.,UNK
1335,Gyro w/ feta. My favorite. Service is always great.,UNK
1336,"cool vibe, nice little getaway",UNK
1337,I maintained my buzz while shopping with my wife.\n\nSolid 4 stars.,UNK
1338,Thank you Jolly!! Highly recommended!! Colonix is a MUST. Very professional and clean facility..,UNK
1339,I have always had an excellent meal here.  I was surprised the one in Phoenix closed down.,UNK
1340,This was my old ramen spot. It was always good every time I came here.,UNK
1341,"Huge place nice Music,the Food was Not bad",UNK
1342,"doesn't matter, had really good food.",UNK
1343,Breakfast is very good especially the Skillets and since they put misters outside on the patio breakfast outside is superb.,UNK
1344,Just don't.,UNK
1345,Worst service I've experienced. It seemed like our server was new.,UNK
1346,Slow food delivery...would have eaten somewhere else.,UNK
1347,"Food is good, but portions are small, and it is ridiculously priced",UNK
1348,I enjoyed the new drink infusions and the server was a hottie!  Great for people watching.,UNK
1349,"Great service, great food, a lively place.  Good for a special date or party.",UNK
1350,This is by far the best place to purchase anything for your home.  They have excellent customer service and not pushy sales people.,UNK
1351,Not worth $60 a night.,UNK
1352,Decent!,UNK
1353,this place is closed!,UNK
1354,I wasnt impressed. The pasties  were so so. Not like they are in the U.P.   Service poor. :(,UNK
1355,"Thanks for moving away from Styrofoam and to plastic! Also, the sugar free syrup options = ++!",UNK
1356,Delicious!  The chicken cordon blu schnitzel is wonderful.  Totally worth the resulting food coma.,UNK
1357,Great coffee and baked goods in a cute atmosphere.  I wish I lived closer because I would be here everyday!,UNK
1358,Pretty good...a little pricey though.,UNK
1359,Overpriced and they stole my ray bans! Epic fail!!,UNK
1360,b&b appliances  don't do any any business with these idiots!!!!,UNK
1361,classic Italian food and a great service!,UNK
1362,"Worst service,  food was cold, took forever  for the food. Beer tasted old. Would  not recommend this place.",UNK
1363,"Amazing service every time I go! Friendly staff, great coffee.",UNK
1364,Best chicken in Pittsburgh.  Better than wings over Pittsburgh and ugly dog.  Great service!!!,UNK
1365,There were zero other people here aside from my friend and I.,UNK
1366,nothing flashy - just a comfortable fitness environment with generally well maintained equipment and facilities.,UNK
1367,Awesome!!!!!,UNK
1368,The $29 Kobe Burger was outstanding! (actually worth the $29 - highly recommend!) - service was very good - Matt,UNK
1369,"Very good, but I like the nearby Thai Chef's Bistro a little better.",UNK
1370,"Nice enough place, but expensive hotels should at least have a little bit of noise containment, and this one doesn't.",UNK
1371,"The best buffet on the strip. Great selection, only problem is the wait. can't really blame them for that.",UNK
1372,Truly a diamond in the rough. The pasta with vodka sauce had my tastebuds jivin' and toes curlin',UNK
1373,Great food and cocktails great casual chic atmosphere will be back,UNK
1374,Absolutely delicious but waaaaaay overpriced.,UNK
1375,Vanessa did a great job of taking care of us.  Service was quick and food was good. Would definitely go again!,UNK
1376,Friendly staff compared to other Ross's I have been to. found few good items. place was not to unorganized.,UNK
1377,"We love this place, great casual food in a casual environment... Always happy when we come here.",UNK
1378,"Great selection of breakfast and lunch items...great service, fast and friendly !!",UNK
1379,Great food and service,UNK
1380,love love love love love they know what they are doing!!!!,UNK
1381,Dave's is always good!!!   Even better today cause it's free! Thank you again,UNK
1382,Excellent food. Delivered to my room at around midnight.,UNK
1383,"I definitely am a big fan of the panda express chain, and just so happens 2 be closest 2 my house. :-)",UNK
1384,Love this place.    Great burgers.   Swanky vibe,UNK
1385,"Clean rooms, just wish they had longer restaurant options. Food they have is good, they just need more staff.",UNK
1386,Cupcakes so good you wouldn't know they were vegan. The owner was really nice too!,UNK
1387,COCKROACH dont go here bad experience never again will go to Bj asian buffet,UNK
1388,Not great at all!! A spot I will not visit again!!,UNK
1389,Never ever ever again. Stinky smelly rooms. Dead roaches. Lousy management.  Don't go.,UNK
1390,Fingerling potatoes!,UNK
1391,Best burgers in Vegas hands down!,UNK
1392,"Boba and food is good, but the service is terrible. Been going here for 4 years and it hasn't changed.",UNK
1393,I bought a Fry Daddy at the Corningware Outlet. That was the highlight of my visit.,UNK
1394,Good luck being a girl and not getting uncomfortably hit on by the staff.,UNK
1395,Place is fire.. The atmosphere is a bit loud but food is amazing. Ceviche extremely fresh and the steak is on point,UNK
1396,It's your typical McD.  Not too good and not too bad.,UNK
1397,The worst tuna sandwich I ever had and the most expensive.,UNK
1398,Great Hotel..... super nice staff great shopping mall....... I will see u soon again.,UNK
1399,Good quick Indian food.,UNK
1400,Too cool!!,UNK
1401,"Second time here, the Drunken Noodles are amazing, super clean restaurant and great service!",UNK
1402,"$7+ for ONE piece of sushi! And how was it?  terrible, terrible!!!!",UNK
1403,"Hmmmmm, I was only in the casino for 10 minutes......I'm all itchy.",UNK
1404,"nice people , good food , one of my favorites to watch a game and play video poker",UNK
1405,"Not what I'd expect\nT-shirts, blue jeans and tattoos\nQuality was ok",UNK
1406,as far as airports go...this is ok cause we only fly SWA.,UNK
1407,It is so average! maybe even below average.,UNK
1408,Awful service. Poor management. Food was decent but not worth the experience of dining there.,UNK
1409,Good food and free pizza is always awesome! Drivers on the other hand speed in my neighborhood and drive like maniacs!,UNK
1410,"The Lobster Bisq was incredible!!!  VERY friendly staff, made you feel at home, truly!!",UNK
1411,Best burritos in Vegas......hands down!!! Red sauce is perfect!,UNK
1412,Hours later and I'm not sick. This place gets the mediocre at best award.,UNK
1413,I love baseball. I love this stadium.  Enough Said,UNK
1414,Really good authentic Mexican food.  Great outdoor bar with a great bartender.  Love it.  Try the shrimp fundido!,UNK
1415,Had the pbj burger! It was so good glad I took the chance and tried something daring!,UNK
1416,Unreliable ! Schedule a meeting for a quote to replace all windows ... never showed up or call.,UNK
1417,"Great thai food, and fast. I would definitely go there again.",UNK
1418,its del taco.  Just order the food as it comes and dont make it complicated and you will be fine.,UNK
1419,not worth the money \nthe food and service is awful,UNK
1420,"Fun little place to have a drink.  Though it was wide open, it still felt cozy.",UNK
1421,Y is this place closed? Didnt pay rent?,UNK
1422,"awesome decor, great crowd and no cover (i think this only applies if you're femme). :)",UNK
1423,"Not much to say, but as a business owner myself, customer service is definitely everything! :)",UNK
1424,This restaurant is now closed and has been replaced by Carnegie Delicatessen. \n\n:'(,UNK
1425,"I'm not a vegetarian but I loved this joint. Great food, good portions, good beer. Nuff said.",UNK
1426,"Great service, fresh seafood. Solid prices. Solid portions.",UNK
1427,"Cheap, great tacos.  Love this spot.",UNK
1428,"The food was on, but everything else was off.",UNK
1429,"This is becoming my favorite Mexican restaurant in Charlotte.  Great food and service, and always have a good Margarita drink special.",UNK
1430,One word: AWESOME!!!!,UNK
1431,The chicken tacos are great I hate them two days in a row since I am not out here much.,UNK
1432,Very good sushi!  its a small hidden place but fantastic rolls!,UNK
1433,Meatmarket for the 30-something crowd.  In all the bad ways.,UNK
1434,"Not a good experience.  Nice enough workers, but they missed so many things. Would not use them again. Total disappointment!!",UNK
1435,Parking's always been easy here. The airport is enormous so arrive with plenty of time to walk across to your gate!,UNK
1436,"Good food, but has slow service! The employee taking the reservation gives the wrong wait time and we had to wait twice as long.",UNK
1437,Overrated sums it up\nSapphires or Olympic garden\nWay better then this tourist trap.,UNK
1438,"Great food, fast service, no efficient organization on faxed orders or online ordering. Keep up the great work though!!",UNK
1439,"I love this location! Wow, you cant go wrong with anything you order here. love it!",UNK
1440,"Unfortunately, as of 09/18/2013 this place is now closed.",UNK
1441,$60 for 4 rolls that we weren't that impressed with... I find that pricey.,UNK
1442,rooms need updating but great casino.,UNK
1443,I come to this location every once in a while and without fail they mess up one part of my order.,UNK
1444,Not even going to write anything.........miserable,UNK
1445,I had the onion soup with the eggplant panini and it was great. Will try this place again,UNK
1446,"Good Southwestern food: Addictive chips, efficient service.",UNK
1447,"Its a McDonalds, clean but staff is young and immature.",UNK
1448,I love the grandview buffet for the Asian Wok! The noodles and vegis on the Wok are amazing!,UNK
1449,The portions are huge and the price is right. Delivery time is within an acceptable time frame too.,UNK
1450,Great food and prices but terrible service.,UNK
1451,They used to have the best cheese plate here.. what happened?,UNK
1452,Had the best time here for monster jam!!\n\nFriendliest staff and a great stadium!!,UNK
1453,I totally agree with Melissa H about the cake (having been in attendance at her wedding).  The cake was delicious !,UNK
1454,Food and service was great.   The only thing I can  complain about is the price.   $18 California roll?,UNK
1455,"Solid Greek place- good size dishes, calamari was tender and there are smaller dishes for the kids.",UNK
1456,Best of the best .....,UNK
1457,The salted caramel cupcake is amazing!,UNK
1458,Food was very good. Service was subpar. The bartender seems to ignored us and was very curt and distracted.,UNK
1459,Pretty dope base! Been here a couple times!,UNK
1460,Good food relaxed atmosphere. Would recommend!,UNK
1461,Today was the second day in a row that this store didnt have crispy fried chicken or crispy chicken strips.,UNK
1462,Reasonable place located about a mile away from the strip!  Rooms are not bad either!  Wish the waiter service was better!,UNK
1463,This pizza is mediocre at best.,UNK
1464,"Mmmmm, best mini burgers in the city!",UNK
1465,"best hot dogs you can get in Las Vegas, angry kimchi fries are quite tasty! highly recommend!",UNK
1466,great and fresh food.  the prices are ok not that sheap.,UNK
1467,The prices are high for the food they serve here. Clerk was kind of pushy and not that nice,UNK
1468,"The food is not at all the quality it should be for the prices. The waiters all seem unhappy, will not return.",UNK
1469,Food is always good but the to-go guy seems a little lost when you are waiting for your to-go food.,UNK
1470,"Quality over Quantity\n\nI'd rather spend my money somewhere else, even if I get half the food.",UNK
1471,5 stars for their red velvet cupcakes. Yummy!,UNK
1472,Came here for the fall festival ... nice ball park and enjoyed the festival!,UNK
1473,Concept is fun to watch but nothing special in taste..,UNK
1474,If your looking for quality food with quality ingrediants. This is not it. Sysco drek!!p,UNK
1475,"Good quality breakfast.  Just had the eggs and bacon with hash, but all were done pretty well.",UNK
1476,kann man empfelen,UNK
1477,My son likes this a bit better than I.  He loves the sweet rice and mango dessert.,UNK
1478,Close to my house and had good pad thai. :),UNK
1479,"Food wasn't anything special, and no diaper changing stations in the bathrooms. The staff is very friendly though.",UNK
1480,"Sadly, this place is closed now. Owner moved back to Cali.",UNK
1481,A little pricey but may check out the catering menu for next party.,UNK
1482,Service was slow. Chili's food is bland.,UNK
1483,Name fits but not in a good way.......,UNK
1484,Average sushi.  Prices a bit higher then average.  Not worth it.,UNK
1485,"Great atmosphere, only\nReason not a 5 because they forgot my order when in a group.",UNK
1486,"MMMmmm, burgers!  Cooked perfect, great serivce, lots of choices on the menu.",UNK
1487,Hours 9:30 to 6:00 everyday closed sat.....now has OPI gel and polish,UNK
1488,Horrible service is an understatement.  Everything wrong. Lower your standards?,UNK
1489,So yummy but they need sodas bc not everyone wants lemonade.,UNK
1490,"I ate pho here everytime and it is really delicious! The owner is super friendly, too!",UNK
1491,"If you like chewing your \""prime\"" beef for 20 minutes and substandard service then hop on in.",UNK
1492,"Fun atmosphere, delicious food, good prices.",UNK
1493,"Queues, queues and more queues\nsame coffee all over world \nOK study place",UNK
1494,The house beers were excellent!! I wish I can say the same for the steak dinner I had but unfortunately not...,UNK
1495,"Nothing really special, found the food over priced for the amount and quality. Over all it was okay.",UNK
1496,Made some mistakes on my order and they weren't busy at all. I'd probably go somewhere else.,UNK
1497,Solid for the price! Wayyy better than little ceasers or dominos.,UNK
1498,awesome breakfast.,UNK
1499,This location does not even compare to the Chandler location.,UNK
1500,"Spent Fathers Day at Skinny Italian. Food Was OK. Will go back again, but not right away.",UNK
1501,Magnifique! Sophisticated and the cuisine was spectacular. This is the essence of fine dining and ambiance.,UNK
1502,Wasn't anything I would return for.,UNK
1503,very british,UNK
1504,"$10 cover, no hats, and they steal your ID.  How is this garbage still in business???",UNK
1505,Very clean and the staff is super friendly.,UNK
1506,Excellent service and good food :) We will be coming back (especially to try the fried ice cream).,UNK
1507,Come here if you are ready to par-Tay!!! Music is too loud.,UNK
1508,Love it.  In and out in less than 20 mins.  4 stars due to they missed few bird poop spots.,UNK
1509,"Best iced mocha around! Super chill vibes, great hipster creepin' if that's your jam.",UNK
1510,Sushi was just ok. The turkey burger was horrible. Everything is overpriced.,UNK
1511,"I love the OG sammich! love, love, love!",UNK
1512,Great food! Great atmosphere! Great beer! We will be going back for sure and brining our friends!,UNK
1513,"Went to get the jeep cleaned, in and out in less then 30 minuites.\nClean inside and out",UNK
1514,Food was okay. Service slow.,UNK
1515,"Over priced, bad food and worse service, in fact the food was indistinguishable from bad Chinese food.",UNK
1516,Pretty decent sandwich shop! The staff is always friendly as well.,UNK
1517,Very nice place tasty food....,UNK
1518,"Good, quick sammy. Lots of options and always tasty.",UNK
1519,What happened to this place? Used to be a nice secret tucked away in gilbert. Now its just blah. So sad,UNK
1520,"4 years later, this place is still terrible. Why my mom likes to go here, ill never understand.",UNK
1521,Poor customer service. Mediocre coffee probably because of poor customer service.,UNK
1522,"Not clean, room sure could use a coat of paint and updating.",UNK
1523,"Wow homemade ice cream cakes too, love this place, they are super friendly!",UNK
1524,Every time we dine here we get exceptional food and service.. Even on busy days its well worth our wait! Enjoy,UNK
1525,It's CVS. Nothing to it.,UNK
1526,"Had decent food, but shitty service. Never returning.",UNK
1527,The Italian Sipping Chocolate is awesome!  I really like the ambiance!!,UNK
1528,Awesome food. Great happy hour.  Amazing staff.  Excellent atmosphere.  The Big Roll is worth it!,UNK
1529,I've come here for extension and makeup services. Beautiful salon and great staff. Probably the best extensions on the strip.,UNK
1530,place is not very clean best thing about it is it is in the same parking lot as the church I am going to,UNK
1531,Avg.,UNK
1532,Great service. The server was pleasant and courteous. Delicious! Nice clean location in centennial hills.,UNK
1533,"They are getting 2 stars only because the beer was decent. The food was okay, but the service was absolutely horrible.",UNK
1534,Horrible customer service. Employee made an error and manager refused to speak with me. This deserves a 0.,UNK
1535,Service ok. Food meh. Drinks ok. The food here has never impressed me. The setting is good.,UNK
1536,"Great atmosphere, good food, and cold beer!  The Black and Bleu Chicken Pita is awesome!!!!",UNK
1537,I love the sauce at Spinato's!  They make a great pizza!  A must try in the Valley,UNK
1538,Great men's cut environment. No girl talk and no nasty salon smells. ESPN on TV. Julie was awesome!,UNK
1539,"I always enjoy my visits here. Genuinely friendly staff, who cares about the quality of their coffee and food.",UNK
1540,Best. Place. Ever.,UNK
