,0,1
3705,"Worst customer service, worst quality, Papa Johns - that's what Papa Johns should change their slogan to.",UNK
3706,"The food was creative yet lacked the fusion to make it wow!\nThe atmosphere needs \""something\""",UNK
3707,Please clean your floor properly.  It feels like Crisco under your feet.  Very dangerous.,UNK
3708,"Love this bar, cheap drinks,  bartender are friendly enough. Bands are OK. I would return again.",UNK
3709,"A great gimmick bar, but too pricey and too cold for us old fogeys!  Worth doing once.",UNK
3710,tried to go on friday night but it was closed. looks like they were booted by the landlords,UNK
3711,Food is good but we waited for half an hour for our food to come. Not good when you're starving.,UNK
3712,Rooms are clean but a little dated.,UNK
3713,Really great spring rolls but the banh Xeo and pho were just ok.,UNK
3714,Pretty Good nothing to write home about.,UNK
3715,"Great value, low price.",UNK
3716,"Service here is consistent, consistantly ignored and neglected that is. Leaving my empty glass to go eat across the street!",UNK
3717,Food was good. Service was spotty. Long waits for everything. Not the cleanest place either.,UNK
3718,"These guys are always helpful when I go in.  I here to ask for Rob, but I have found everyone to be pretty decent.",UNK
3719,$9 for a sandwich only. It was not worth it.,UNK
3720,Love their food and happy hour specials. Only bummer is that the service is extremely slow and it is SO hot inside!,UNK
3721,I had to stop here just to pee and would never go in there again way to smokey.,UNK
3722,"Had the fish, looked better then the beef.",UNK
3723,Food was just ok. Nothing to write home about. The server was terrible. Would not eat here again.,UNK
3724,When on Friday night the worts service we leave 5 min after our arrival never going back they are really rude,UNK
3725,"Num, num, num.   For fast food one of the better choices you can make",UNK
3726,My favorite Taco Tuesday in old town! Great shredded beef tacos. Really great deals.,UNK
3727,This should be on bar rescue.,UNK
3728,"I'm a M&M collector, no where else has this kind of selection!",UNK
3729,Food is good but a little pricey for the quality.,UNK
3730,"Was very quiet for a Saturday night. Food ok, staff lovely.",UNK
3731,"Had their food truck ice cream, so yummy!",UNK
3732,Pizza was god but you need to take a second mortgage to pay for it,UNK
3733,of all the buffets I had in Vegas this was my least favorite!,UNK
3734,"Great service, a little slow, but overall pleased.",UNK
3735,Nice outlet mall with nice choices but packed with noisy customers all looking to shop.,UNK
3736,Yuck!  Maybe I just don't like cajun food and fish though?!,UNK
3737,"I've never had a problem, but I only use the drive-thru ATM.",UNK
3738,"Great burgers, amazing fries, horrible service. Plain and simple. Management should take note of this, as well.",UNK
3739,The worst excuse for Chinese food ! The only tying I ate were the fortune cookies.,UNK
3740,Still good but the quality and the service appear to be on the decline. Both used to be above average.,UNK
3741,My friend and I both got sick after eating their chili dog.. not recommended!,UNK
3742,Creative dishes but too expensive. Portions were really small. We spent $45 and were still hungry.,UNK
3743,"Friendly group, but the fees they charge are out of this world.",UNK
3744,Rate this place 3.5. Good food and service.,UNK
3745,Good place to eat and have a few beers.  Best Calamari.,UNK
3746,I love this place! Great brunch! I love the goat cheese appetizer!,UNK
3747,"good place for workdays lunch. Large portion. Ordered combo pho and summer rolls, nice!",UNK
3748,"Nice hotel, only complaint is the rooms seem a little dated. Nice bar and restaurant, and staff very friendly.",UNK
3749,The happy hour here is amazing!,UNK
3750,Very good food but a little pricey so I dropped them back a star. The service was excellent.,UNK
3751,Loved this place.  Burgers are awesome.  Especially with the baked potato fries.  Loved sitting outside.  Great family place.,UNK
3752,Really darn good pastries! \nAlso lots of great snack gifts that are beautifully packaged.,UNK
3753,easy to drop off ink cartridge for recycling but they don't offer battery recycling. kind of a bummer.,UNK
3754,"Asshole bouncers. Matt cox, the manager, is  the leader of all assholes",UNK
3755,The owner is a real asshole and the food is sub par. Never again.,UNK
3756,Great wine and tapas. Service was great,UNK
3757,"Creative dishes, good cocktails, and good service. Casual but contemporary atmosphere. Casual dress.",UNK
3758,Thought the restuarant was more about style than substance.,UNK
3759,"Dead roach on the bathroom floor when we walked in, and cigarette burns in the sheets. Think twice before you book here.",UNK
3760,"Decent place, clean, nice rooms, great location, quite a few amenities.",UNK
3761,"service was slow, food sucked",UNK
3762,Nice little place! The food is good for a little independent place and if you're looking for something quick.,UNK
3763,Had the sliced beef brisket combo.  Sandwich was really good!! Look forward to returning soon.,UNK
3764,Great customer service,UNK
3765,Been closed for at this location forever ...contacted by management and they have a new place  83rd ave and Thunderbird.,UNK
3766,"This place sucks, not good Mexican food. The Taco Bell I had the other day was more authentic.",UNK
3767,"The sales department here is very good. The service department isn't too bad, but could use improvement.",UNK
3768,"Very expensive hotel, but very good service overall.",UNK
3769,The calamari tasted old and so did the eel. Old is not a comforting taste when eating sushi....,UNK
3770,This place does not even deserve one star. The place was dirty and the service stunk.,UNK
3771,Service was great but the sushi was very plain. Could use some special rolls on the menu as well.,UNK
3772,"Nice for parties, it was very nice of them to host the Yelp party.",UNK
3773,It's an IGA now.,UNK
3774,"We spent our anniversary here.  It was a good place to do so.  Very quiet and nice, but not a lot happening.",UNK
3775,The first time was a 10 star - this time the whole place looked worn out - the service and the food has gone down!,UNK
3776,Always good pizza and friendly staff!  For a fast food kind of pizza I've yet not to like a pizza from this location!,UNK
3777,Love love love the carpaccio. Never had anything else and don't want to. You will not be disappointed.,UNK
3778,Terrible...so so so terrible. Even if it was free i would have to seriously think about it.,UNK
3779,Good selection of beer and wine.  Good service and atmosphere as well...,UNK
3780,I cried there!;(I wanted to see what i could get if i traded my oldsmobile and they laughed!,UNK
3781,After my knee replacement surgery they were too aggressive and I have since had to get a manipulation done.,UNK
3782,"What you expect out of a 24 hour diner.  Food can be pretty good, service can be pretty bad.",UNK
3783,We chose the signature sandwich and it was tasty.,UNK
3784,Average beer... Great food.,UNK
3785,"Absolutely love the sushi, but the service is NOT the best.  5 stars for the food, 1 stars for service.",UNK
3786,Three stars for cheerful and quick service at 5:30 AM...,UNK
3787,Great atmosphere. Great food. Service was slow today.,UNK
3788,never has crushed peppers! \n\nbut the pizza ain't too shabby.,UNK
3789,I personally only liked the free show with the women. I didnt really care for this place.,UNK
3790,Great overall!!!!,UNK
3791,You get what you paid for. But it's clean and it's ok. It's on the strip.,UNK
3792,"Seriously, owners of this place, why do you think that deliveries that take at least an hour are okay??",UNK
3793,"Good vibe, fried chicken was real good! Was not a big fan of the beef tacos though, drinks are amazing.",UNK
3794,Why did you ask me to contact you if you weren't going to respond? \n\n#youretheworst,UNK
3795,Tuna melt is also very good. I get cravings for their tuna melt.,UNK
3796,Years and years ago this place used to be pretty damn good and now it's about even with fast food if that,UNK
3797,Cute and convenient. Friendly service. Not sure about the hype. Croissant and espresso were just okay.,UNK
3798,They dont have a phone number listed at all. Good luck in rescheduling if you can not make something.,UNK
3799,In one word: disappointing. Could not eat the meat and there was nothing to good to order for my 3y daughter.,UNK
3800,Shady and smelly. Avoid.,UNK
3801,Bad service and a bunch of bros.,UNK
3802,Food excellent as always but still service problems. They would get 5 if service was ANY good.,UNK
3803,Convert this to an Adonis and you will get 5 stars...,UNK
3804,Meh. I've experienced better,UNK
3805,Excellent barbecue. The meat has a smoky flavor. Nice country atmosphere,UNK
3806,"Only for Buffet. Worse ever, don't go here unless you're a vegetarian.",UNK
3807,"Server was not friendly, french toast was dry bread inside. Been here before and it was much better.  Enough said",UNK
3808,"Good service, good food.  Par with other Red Robin's we've been to!",UNK
3809,"Gas is decently priced but if you are a smoker, one of the best priced around.",UNK
3810,"The food was great, but wasn't good enough to make up for the service.",UNK
3811,Bleh. Thats all i'm gonna say.,UNK
3812,"Excellent service and wings were fantastic.  Love the sour cream fries!  A little noisy, but it is snowbird season.",UNK
3813,This place has been closed for many years and reopened more then 2 or three times.,UNK
3814,I typically like this place but I don't like the limited weekend brunch menu served until 2pm.,UNK
3815,Tasted like a frozen dinner. Tiny portions. $100+ per person. Awful. Service was confrontational and rude.,UNK
3816,The lunch buffet? Totally worth it.,UNK
3817,White peach margarita was so delicious!! Had the salmon for lunch and it was the best I have ever had!,UNK
3818,"The food, service, locattion = just ok.  After reading the reviews, I was expecting more.",UNK
3819,Food is good. Customer service sucks!!,UNK
3820,"Service and food was good, would had liked bigger portion size for the price. The small size did not feed me and my girlfriend.",UNK
3821,Had escargot for the first time .. Interesting not sure ill ever try that again but the salmon was good,UNK
3822,"Ok. But I wouldn't go back.\nSo many good places in Vegas, this was my worst meal here.",UNK
3823,Ehh. Ok. Cool views from outside,UNK
3824,Enjoyed breakfast this morning and our waitress Cece was the best.  Definitely recommend this place.,UNK
3825,"Good shrimp. So so ambiance, good service. The rest of the food was a bit disappointing.",UNK
3826,Had the mixes seafood plater the shrimp really stood out.  Next will go for the giant shrimps dish.,UNK
3827,Quality ingredients and good flavor.  Its decent takeout.,UNK
3828,One of my favorite shopping places on the strip. I love the atmosphere of this place. My favorite store there is the Nike shop.,UNK
3829,Yea...I got in free for a reason.  They just want anyone in there.,UNK
3830,Eek!\nMe thinks not.\nThe lady bartender was so rude....we left.,UNK
3831,poor service. rude servers. only go there when I have having a pho craving and there is no other choice,UNK
3832,"my falafel was ok, but my brother kabob was really good. great location. reasonable price",UNK
3833,Do not go this place! They are dishonest and way too much overcharged!,UNK
3834,"Rude staff, spoke to Chris, who runs their Facebook page and will never go here again!",UNK
3835,sushi was OK bit $$$ for what it is but the waiter was great,UNK
3836,"Appreciate the convenience, just wish the customer service was better",UNK
3837,Excellent! It's the first stop we make when we arrive in AZ. Great food reasonable prices.,UNK
3838,Not surprised.....,UNK
3839,Very good.,UNK
3840,"Out of rolls, out of flatbread, out of toilet paper in the ladies room and only 745pm",UNK
3841,It was so much better a few years ago.,UNK
3842,Expensive and just ok.,UNK
3843,Low class Italian food.  Will not be back,UNK
3844,"Quick update, the Drive-Thru guy is \""Brad\""",UNK
3845,"Bon, mais pas impressionne! Un peu cher pour un dejeuner...",UNK
3846,Two words: chickpea ceviche\nIt's tasty and sweet.,UNK
3847,name changed to El Segundo Sol but website remains cafebabareeba.com,UNK
3848,Very quality burgers and drinks at affordable prices.  Good for groups.,UNK
3849,"I don't think this place even deserved a single star,lousy service and disrespectful!!",UNK
3850,Good food and good value with decent service.,UNK
3851,Cleanest kitchen I have ever seen!,UNK
3852,"Horrible service, the SAs and store managers are very rude. Will not buy LV again!",UNK
3853,Very good cornbread!\n\nSweet style sauce.,UNK
3854,Not a bad stay.,UNK
3855,"Everything appeared wonderful until I bit into a piece of cardboard, and my night began to spiral down hill :(",UNK
3856,Why have a phone if you NEVER answer.. very annoying!!!,UNK
3857,"I love El Zocalo! I wish this restaurant was a little bit closer to us, because we would visit more!",UNK
3858,nice design...they forgot the quality food....,UNK
3859,Food was decent-good portions. Maybe the sticky menu just threw me off.,UNK
3860,Total crap shoot. Room reservation receptionist rude and unprofessional.  You get what you pay for.,UNK
3861,had carne asada burrito was not that good definitely had better customer service was shitty & wouldnt try again .,UNK
3862,"I was there to see Dixie Swim Club, The play was fun the actors were very good.  The food was horrible!!",UNK
3863,Worst service ever. Rude. Don't explain anything and expect you to carry a huge bowl and an additional plate.,UNK
3864,We didn't even get to eat! The hostess skipped over us and made us wait over an hour before we left.,UNK
3865,Outdated but bed was comfy. They are renovating in March 2012 though,UNK
3866,You could not believe the husting I got from the dealers for tips at this place.,UNK
3867,The club was really spacious. You didn't feel like you were confined to two areas. It was fun dancing on the water.,UNK
3868,"Average, but good food in a 50's diner",UNK
3869,Great service.  Good food. Great naan.,UNK
3870,"Fire is all I can say. Huge tacos, great ingredients, I feel like I'm back in Chicago",UNK
3871,They didn't want me to stay during lunch time for 3 hours to do my work. Bad for u guys.,UNK
3872,Love the horseshoe,UNK
3873,Apparently they are no longer in business. The number i dialed is not in service.,UNK
3874,"Best and worst bar in Charlotte, NC",UNK
3875,My quilt has the strongest chemicaly perfumey scent to it. Will update if they fix this.,UNK
3876,this is the best car wash that I have used in Phoenix.  yelp coupon doesn't hurt either.,UNK
3877,"Very good chips and salsa. Prompt, fast service.  Will return in future.",UNK
3878,Good flavor selection. They offer that you try flavor. Ample parking.,UNK
3879,Great for Saints and LSU games.,UNK
3880,Poor representation of a BBQ place.  Food was at best so-so.  Lots of places much better nearby.,UNK
3881,Not impressed with the food. The food really lacked seasoning and taste.,UNK
3882,"dont worry about the line, it moves fast.",UNK
3883,"Small local restaurant, but cheap price, good food, and lovely owner sing a song for you.",UNK
3884,Slow service. I've come multiple times to the drive through and end up waiting more than five minutes for service.,UNK
3885,I stopped since it was close to home. Food and service are good but i have my preferred spots.,UNK
3886,"Small for such a large casino,  competent staff.  Lots of passing thru foot traffic.",UNK
3887,Not much of a selection :/ the guy who works there is pretty nice,UNK
3888,Great pizza and wings nice inside and clean,UNK
3889,Great service and of course AWESOME chips and salsa.,UNK
3890,"After the change of ownership, this place is horrible now.  It's just too salty!",UNK
3891,Not worth the trip.,UNK
3892,There is not enough server so I didnt get help as much as I need and it is very expensive and air conditioner is broken,UNK
3893,"The owners a a bit snarky, but you can't beat the location.",UNK
3894,CLOSED. This building is shuttered and the place is CLOSED.,UNK
3895,Worth a visit...pizza crust had nice bite...fresh toppings....caprese salad was delicious,UNK
3896,Meh. Was upset to find out their hot chocolate is just warmed up chocolate milk.,UNK
3897,Truly a horrible experience. Everything was rushed with very little professionalism. Never coming back here again with my gf. :(,UNK
3898,The attendant was really smug and snobby about biking. I did not like his attitude.,UNK
3899,Very delicious crepes!!,UNK
3900,"Seriously they need to figure out how to follow instructions. Every time I order online, it is completely wrong.",UNK
3901,Yummy pizza!!!,UNK
3902,Always friendly :) easy access on and off the highway which is great for the work commute!,UNK
3903,All i have to say is this place is - Grrrrreat ! Very relaxing lounge and good place to eat after midnight .,UNK
3904,Hole in the wall with mediocre food would not go back!,UNK
3905,Worst experencw of my life. Want to be lyed to sign up with direct tv,UNK
3906,"Not the greatest, but I've stayed at worse. My view is a homeless encampment.",UNK
3907,Fun pool atmosphere! Good music & wonderful staff. The property in general needs to be unkept better though!,UNK
3908,One of my favorite spots for me and the girls in the arts district!,UNK
3909,This place is long closed; a Mexican restaurant is there now.,UNK
3910,Great music,UNK
3911,Pay attention to customers instead of talking as they are obviously waiting for you at the counter.......,UNK
3912,"nice place, great food and friendly  staff.  however  won't recommend  if you're  a non smoker.",UNK
3913,As WalMarts go this one is better than average.,UNK
3914,this place has been Charlotted. that means a place was once cool and now the soul has been sucked out of it.,UNK
3915,This place is outstanding great food friendly helpful service and very reasonably priced it's just not fancy definetly a favorite,UNK
3916,"Food was good, but nothing special. Nothing compares to the Mandalay Bay buffet though lol.",UNK
3917,Way overpriced for average food and less than average atmosphere.,UNK
3918,So much Fun!  The preformers are having a great time. The audience is having a great time.  Go see this show.,UNK
3919,Huge place big selection lots of gaming space....customer serviced needs work.,UNK
3920,gross. This place is widely known as the toilet of all strip clubs.,UNK
3921,The food is decent but the enormous portions are unnecessary. I am not fond of leftovers especially when it's breakfast food.,UNK
3922,This store focuses on store policies than customer service.,UNK
3923,Lamb is the specialty. They can make sangria with your wine too.,UNK
3924,If your looking for a new hair style I recommend curl up and dye. Staff is great very creative and open to all,UNK
3925,its good not  very clean but its good fast food,UNK
3926,Come early there is always a wait bc it's so popular,UNK
3927,Brian the bartender was the bomb! Mango margarita was the shit! Turkey club was very good. My experience was great!,UNK
3928,First visit last night and we most def will be back!  Great food and even better service.  Wonderful local establishment!,UNK
3929,Everyone very helpful  and this Friday there giving a free donut with every coffee sold,UNK
3930,Great Pizza! Horrible Service!!!!,UNK
3931,Not the same quality of food compared to the W. Charleston location...,UNK
3932,If you want an Italian cheese crisp go here. If you want Pizza go anywhere else. NOT worth the wait.,UNK
3933,"Nothing special... Side items were good, but ribs were blah! I wouldn't make this a regular place..",UNK
3934,"The Detour bar and grill is closed, out of business.",UNK
3935,"horrible, horrible service!",UNK
3936,Needed a cheap place to stay for a few days. This was excellent in that regard.,UNK
3937,"Decent spot on Central Ave... Great sandwiches, good service, blah, blah, blah....",UNK
3938,Bartender is the rudest p.o.s.,UNK
3939,Horrible. Don't waste your time or Vegas gambling money. Eat a hot dog instead. Much better meal.,UNK
3940,today was not as good as usual. I have given up on this inconsistent restaurant.,UNK
3941,It's too confusing to order here.\nMakes me get a rash.,UNK
3942,Interesting place in the middle of the desert between AZ and CA.,UNK
3943,The Staff is super friendly.  The machine are horrible.  Have a drink and run because you can't win!!,UNK
3944,You should check out PlayNetwork.com.  Great customer service with a ton of service options that won't break the bank.,UNK
3945,4 for service\n3 for food\n4 for being open 24 hours,UNK
3946,Very expensive with no choices.,UNK
3947,"The casher handled money and made my order without washing her hands, Yuck!!",UNK
3948,Decent! Nothing to write home about. Clean good food!,UNK
3949,What do you expect it is TGI Friday's.  Only thing open late night at Aliante.,UNK
3950,owner is a terrible terrible person. tossed me out for no good reason. i found the food very average overall,UNK
3951,"Not my favorite grocery store, but I love the set up of the store.",UNK
3952,"For vegans, as of this date the veggie burger is garden burger brand, and is not vegan.",UNK
3953,Oscar was so RUDE when picking are orders .... Send him to customer service training!!!!!,UNK
3954,WALLYMART! The freaks are out in force today!,UNK
3955,The head chef left.  Sushi & service suffers terribly.,UNK
3956,"It's like Jamba Juice, but not quite Jamba Juice. I will not be changing anytime soon.",UNK
3957,Thank you.,UNK
3958,the food just keeps getting worse and the other day there was a three hour wait.  never going back.,UNK
3959,bumped up a star because they fixed their mistake and gave me a credit.,UNK
3960,"The biggest collection of garage sale rejects in the city.\nItems are dirty, dusty and of questionable working order.",UNK
3961,It was very delicious and tastey.,UNK
3962,Their burgers are good. That's the only thing good I can really say about this place.,UNK
3963,"Pretty good. Food was tasty, but I have texture issues and had a hard time with some of the texture combos.",UNK
3964,It was ok. Wifi didn't work and air conditioning wasn't all that great. Everything else was just ok.,UNK
3965,Visited again but seemed the menu is limited during the weekday.,UNK
3966,not to shabby for some Tuesday night tacos on  especial,UNK
3967,"This place is always so dirty and grimy, been there twice and will not be back.  Customer service is horrible!!!",UNK
3968,"Cool neighborhood place.  Nothing fancy, just a good place to have some wings and bear.",UNK
3969,"Very disappointing Christmas Eve dinner. Lovely venue...but food was \""meh\"" and service was worse. I",UNK
3970,Short and sweet. Dont bother! This is not authentic this is just not good.dont eat here.,UNK
3971,Good tight nit fun.  Chill.  Nothing special though.,UNK
3972,Fair enough to get my gas to continue my trip... That is all!,UNK
3973,AWFUL!!!!  Very unorganized.....does not deserve the one star,UNK
3974,Average.,UNK
3975,Have you heard the. Story of the crooked  cleaner ??,UNK
3976,Ok as airports go.,UNK
3977,"Dirty gross, all the bums hang out here. Avoid!",UNK
3978,Had a really nice meal with huge selection. Food was top notch and price was very reasonable. Would recommend.,UNK
3979,Pretty good. Probably won't return though.,UNK
3980,Nasty & Dirty.  Food is okay.  They do a great steak.  The place is full of regulars drinking cheap beer.,UNK
3981,One of the worst places to get customer service. A horrible experience trying to order and get installation done for my house,UNK
3982,Update: They never did get back to me.,UNK
3983,CLOSED! - This pretty bad place finally folded!,UNK
3984,Just alright.  Had this baked potato with some of their BBQ brisket on top.  It was OK.,UNK
3985,Somethings were really good but there were a few things that were cold. Tad disappointed.,UNK
3986,This place still stinks.  Maybe they can become a vets office or something useful.,UNK
3987,It's just ok.  Pricey.  I've had better.,UNK
3988,Lots of different specials though out the week. Never to busy they have pool tables.,UNK
3989,Good beer and that's just about the only good thing,UNK
3990,They need to say they are closed and out of business on their voice message.,UNK
3991,The food was okay nothing really special on the buffet menu. Fast and friendly service though is nice.,UNK
3992,Yuck. This place has nothing to recommend it. Avoid.,UNK
3993,Its a cool place to visit.  Somethings are cool but i found a lot of things to be overpriced.,UNK
3994,Good food. Good service. Open 24 hours.,UNK
3995,Good place.,UNK
3996,"$4 bucks for a cup of coffee that i can finish in three sips, really?",UNK
3997,Quality is awful service is worse,UNK
3998,Once was enough.,UNK
3999,Wifi doesn't work in many of the public areas!  You'd expect them to get it right.,UNK
4000,"Great place for late night food runs, Not the best food, but then again can't expect 5-star dining at 3am",UNK
4001,Unfortunately this place is going downhill. Not sure the reason. Poor service with ok food.,UNK
4002,"It was ok. Not awful, not great.",UNK
4003,This place has NEVER gotten our order right.  Not once.  Lame.,UNK
4004,"Nice enough place, good service but the food was very bland, Parisa is just a few blocks away and a much better option",UNK
4005,Wine? Yes. Food? No. Stay away from the lobster bisque...too fishy.,UNK
4006,"Nice rooftop deck. They don't have many beers, but some different mix drinks made up for it.",UNK
4007,Pork only. No order duck. 15% mandatory tips on the four square iPad.,UNK
4008,They take reservations but apparently it's up to the manager to make sure your party has seating or not.  Worst service ever.,UNK
4009,My car AND my friend's car were both keyed in the parking lot here. I haven't been back since.,UNK
